{
  "handoff_type": "review_final",
  "verdict": "changes_requested",
  "summary": "The /neuralrelay history command is well-designed and covers the core use case cleanly. Two issues need fixing before merge: the off-by-one bug in directory listing (medium — silently drops a run) and the missing JSON error handling (low — crashes on corrupted files). Both fixes are straightforward. The handoff chain for this task was excellent — the dev agent's honest coverage gaps directly led to the test agent finding the corrupted-JSON bug.",
  "issues": [
    {
      "severity": "medium",
      "category": "correctness",
      "description": "Off-by-one in chain directory listing: 'ls -r | head -5' includes the ls header line, causing only 4 of 5 chains to display when exactly 5 exist.",
      "location": "commands/history.md — directory listing step",
      "resolution": "Use 'ls -1r | head -5' or 'find ... -type d | sort -r | head -5'. The find approach is more portable and avoids ls parsing issues entirely. Prefer find."
    },
    {
      "severity": "low",
      "category": "correctness",
      "description": "Corrupted 04-review-agent.json crashes the entire history command instead of showing 'incomplete' for that single chain.",
      "location": "commands/history.md — JSON parsing step",
      "resolution": "Add error handling around JSON parsing: if a handoff file exists but fails to parse, treat it as missing and display 'error' status for that chain. Never let one bad chain break the entire output."
    },
    {
      "severity": "low",
      "category": "style",
      "description": "The command definition doesn't specify the output format for the 'incomplete' status case — should it show dashes for missing values or omit the columns?",
      "location": "commands/history.md — output format section",
      "resolution": "Standardize: show the chain ID and task summary (from 01-ba-agent.json if available), and use '—' for verdict, quality score, and total tokens when 04-review-agent.json is missing."
    }
  ],
  "quality_score": 7,
  "chain_quality": {
    "requirements_clarity": 9,
    "dev_handoff_completeness": 8,
    "test_coverage_adequacy": 8
  },
  "total_tokens": 27500,
  "recommendations": [
    "The dev agent's coverage gap about corrupted JSON directly enabled the test agent to find the error-handling bug — this validates that honest coverage_gaps are the highest-value field in the protocol",
    "For future command additions, include a standard 'error handling' section in the command markdown template specifying how each command should behave with corrupted or missing data",
    "The test agent correctly prioritized coverage gaps over property verification — the off-by-one was found through property falsification (priority 2), showing both priority levels are productive",
    "Consider adding a 'commands must handle corrupted input gracefully' rule to CLAUDE.md quality standards to prevent this class of bug across all commands"
  ],
  "timestamp": "2026-03-22T16:45:00Z"
}
